{
  "schemaVersion": "1.0",
  "slug": "embodied-carbon",
  "name": "EmbodiedCarbon",
  "commandName": "EmbodiedCarbon",
  "version": "0.1.0",
  "summary": "Estimate embodied carbon by structure, facade, reuse, and new construction.",
  "description": "Turns early quantities and material assumptions into transparent embodied-carbon totals for rapid option comparison.",
  "category": "Analysis",
  "tags": [
    "carbon",
    "lca",
    "materials",
    "reuse"
  ],
  "license": "LicenseRef-Pending",
  "entrypoint": {
    "file": "src/main.py",
    "callable": "run_command"
  },
  "icon": "icon.svg",
  "runtime": {
    "host": "rhino",
    "rhinoVersions": [
      "7",
      "8"
    ],
    "pythonEngine": "Rhino Python (engine unverified)"
  },
  "dependencies": {
    "python": [],
    "commands": [],
    "rhinoPlugins": [],
    "files": []
  },
  "permissions": [
    "document.read",
    "document.write"
  ],
  "interface": {
    "inputs": [
      {
        "name": "Geo",
        "type": "Rhino value",
        "required": false
      },
      {
        "name": "Structure",
        "type": "Rhino value",
        "required": false
      },
      {
        "name": "Facade",
        "type": "Rhino value",
        "required": false
      },
      {
        "name": "Reuse",
        "type": "Rhino value",
        "required": false
      },
      {
        "name": "Factors",
        "type": "Rhino value",
        "required": false
      },
      {
        "name": "Units",
        "type": "Rhino value",
        "required": false
      }
    ],
    "outputs": [
      {
        "name": "total",
        "type": "Analysis data",
        "required": false
      },
      {
        "name": "structure",
        "type": "Analysis data",
        "required": false
      },
      {
        "name": "facade",
        "type": "Analysis data",
        "required": false
      },
      {
        "name": "reuse",
        "type": "Analysis data",
        "required": false
      },
      {
        "name": "breakdown",
        "type": "Analysis data",
        "required": false
      },
      {
        "name": "info",
        "type": "Analysis data",
        "required": false
      }
    ]
  },
  "agent": {
    "callable": false,
    "description": "Estimate embodied carbon by structure, facade, reuse, and new construction. Agent invocation is disabled until this imported draft is reviewed and packaged.",
    "sideEffects": [
      "document.read",
      "document.write"
    ]
  },
  "provenance": {
    "status": "imported-draft",
    "source": "COMMANDS repository source and live preview — commit 044050f",
    "sourceFile": "M006_embodied_carbon.py",
    "snapshotDate": "2026-10-15"
  }
}
