{
  "schemaVersion": "1.0",
  "slug": "sun-facade",
  "name": "SunFacade",
  "commandName": "SunFacade",
  "version": "0.1.0",
  "summary": "Size facade openings from annual direct-sun exposure per panel cell.",
  "description": "Samples annual direct sun with context shading and maps weighted or inverted exposure values to centered opening sizes.",
  "category": "Facade",
  "tags": [
    "facade",
    "solar",
    "openings",
    "environmental"
  ],
  "license": "LicenseRef-Pending",
  "entrypoint": {
    "file": "src/main.py",
    "callable": "run_command"
  },
  "icon": "icon.svg",
  "runtime": {
    "host": "rhino",
    "rhinoVersions": [
      "7",
      "8"
    ],
    "pythonEngine": "Rhino Python (engine unverified)"
  },
  "dependencies": {
    "python": [],
    "commands": [],
    "rhinoPlugins": [],
    "files": []
  },
  "permissions": [
    "document.read",
    "document.write"
  ],
  "interface": {
    "inputs": [
      {
        "name": "S",
        "type": "Rhino value",
        "required": false
      },
      {
        "name": "Ctx",
        "type": "Rhino value",
        "required": false
      },
      {
        "name": "Lat",
        "type": "Rhino value",
        "required": false
      },
      {
        "name": "Lon",
        "type": "Rhino value",
        "required": false
      },
      {
        "name": "W",
        "type": "Rhino value",
        "required": false
      },
      {
        "name": "Hp",
        "type": "Rhino value",
        "required": false
      },
      {
        "name": "Min",
        "type": "Rhino value",
        "required": false
      },
      {
        "name": "Max",
        "type": "Rhino value",
        "required": false
      },
      {
        "name": "Weight",
        "type": "Rhino value",
        "required": false
      },
      {
        "name": "Invert",
        "type": "Rhino value",
        "required": false
      },
      {
        "name": "Flip",
        "type": "Rhino value",
        "required": false
      },
      {
        "name": "Step",
        "type": "Rhino value",
        "required": false
      },
      {
        "name": "North",
        "type": "Rhino value",
        "required": false
      }
    ],
    "outputs": [
      {
        "name": "frame",
        "type": "Rhino geometry / analysis data",
        "required": false
      },
      {
        "name": "openings",
        "type": "Rhino geometry / analysis data",
        "required": false
      },
      {
        "name": "glass",
        "type": "Rhino geometry / analysis data",
        "required": false
      },
      {
        "name": "sun",
        "type": "Rhino geometry / analysis data",
        "required": false
      },
      {
        "name": "ratio",
        "type": "Rhino geometry / analysis data",
        "required": false
      },
      {
        "name": "info",
        "type": "Rhino geometry / analysis data",
        "required": false
      }
    ]
  },
  "agent": {
    "callable": false,
    "description": "Size facade openings from annual direct-sun exposure per panel cell. Agent invocation is disabled until this imported draft is reviewed and packaged.",
    "sideEffects": [
      "document.read",
      "document.write"
    ]
  },
  "provenance": {
    "status": "imported-draft",
    "source": "GH Library snapshot — 2026-10-15 · source reconciled with COMMANDS 044050f — 2026-10-20",
    "sourceFile": "F002_sun_openings.py",
    "snapshotDate": "2026-10-15"
  }
}
